{"schema":"chancadem.manifest/v1","case_id":"HP500-02","title":{"en":"HP500 survey 2: setting 54 mm, feed f80 84 mm","es":"Muestreo HP500 2: abertura 54 mm, f80 de alimentación 84 mm"},"category":{"en":"Real surveys: Metso HP500 at Minas Rio","es":"Muestreos reales: Metso HP500 en Minas Rio"},"stage":"secondary","control":null,"real_or_synthetic":"real","expected_band":{"en":"Survey 2 measured 1267 t/h and 212 kW at a setting of 54 mm and a feed f80 of 84 mm. The calibrated engine should land within 29 percent of the measured throughput, between 900 and 1634 t/h, with a P80 between 18.9 and 59.4 mm (0.35 to 1.1 times the setting) and a reduction ratio between 1.8 and 4.","es":"El muestreo 2 midió 1267 t/h y 212 kW con una abertura de 54 mm y un f80 de alimentación de 84 mm. El motor calibrado debe quedar dentro de 29 por ciento del tonelaje medido, entre 900 y 1634 t/h, con un P80 entre 18,9 y 59,4 mm (0,35 a 1,1 veces la abertura) y una razón de reducción entre 1,8 y 4."},"context":{"problem":{"en":"Survey 2 of the industrial HP500 secondary cone at Minas Rio is a measurement, not a simulation. The question is how close the calibrated engine gets to the tonnage the plant actually fed at this setting and this feed size.","es":"El muestreo 2 del cono secundario industrial HP500 de Minas Rio es una medición, no una simulación. La pregunta es qué tan cerca llega el motor calibrado al tonelaje que la planta realmente alimentó con esta abertura y este tamaño de alimentación."},"variables":{"en":"Measured closed-side setting 54 mm and feed f80 84 mm; measured feed rate 1267 t/h and power 212 kW. The throw and the speed are the HP500 nominal values and the feed shape is reconstructed from the f80.","es":"Abertura de lado cerrado medida 54 mm y f80 de alimentación 84 mm; flujo de alimentación medido 1267 t/h y potencia 212 kW. La carrera y la velocidad son los valores nominales del HP500 y la forma de la alimentación se reconstruye a partir del f80."},"reading":{"en":"The measured throughput and power are the reference of the gauges; the product size is a model output, since the paper reports it only in figures. The Benchmark page holds the leave-one-survey-out validation of this survey.","es":"El tonelaje y la potencia medidos son la referencia de los indicadores; el tamaño del producto es una salida del modelo, porque el artículo lo entrega solo en figuras. La página de Benchmark contiene la validación dejando un muestreo fuera de este muestreo."}},"engine":{"package":"pipeline.model.crusher","version":"0.11.000","model":"Whiten population balance with Andersen classification, JKMRC t10 and Austin appearance breakage, Evertsson capacity and Bond power (HP500 calibration of Rocha et al. 2024)"},"params":{"machine":"cone-sec","css_mm":54.0,"throw_mm":34.0,"speed_rpm":360.0,"feed_x63_mm":49.50410982641145,"feed_m":0.9,"ore_axb":677.3,"ore_wi":9.0,"calibrated":true},"seed":42,"artifact":{"path":"HP500-02/trace.json","format":"json","trace_schema":"chancadem.trace/v1","bytes":3960,"sha256":"4cdc9b97cccc2bc157d8a53059e75e62c4e0248d922cceeac1aba8448a7dc027"},"lane":"live","gate":{"lane":"live","pure_python":true,"wheels":[],"trace_bytes":3960,"run_ms_budget":1500.0,"trace_bytes_budget":262144,"reasons":[]},"flags":[],"metrics":{"p80_mm":31.3613,"p50_mm":13.7823,"p20_mm":3.00998,"f80_mm":81.701,"reduction_ratio":2.60515,"throughput_tph":1208.87,"power_kw":413.846,"specific_energy_kwh_t":1.01829,"throughput_err_pct":-4.58813,"power_err_pct":95.2104},"models":{"surrogate-model":"real","anomaly-model":"real"},"expect":{"p80_mm":[18.9,59.4],"reduction_ratio":[1.8,4.0],"throughput_tph":[900.0,1634.0]},"source":{"kind":"publication","citation":"Rocha, B.K.N.d.; Campos, T.M.; Silva, J.; Tavares, L.M. Fit-for-Purpose Model of HP500 Cone Crusher in Size Reduction of Itabirite Iron Ore. Minerals 2024, 14(9), 919. https://doi.org/10.3390/min14090919 (CC BY 4.0).","doi":"10.3390/min14090919","license":"CC BY 4.0"},"measured":{"survey":2,"f80_mm":84.0,"css_mm":54.0,"feed_tph":1267.0,"power_kw":212.0}}