{"schema":"chancadem.manifest/v1","case_id":"S03","title":{"en":"Cone secondary, hard ore, over-speed","es":"Cono secundario, mineral duro, sobrevelocidad"},"category":{"en":"Secondary cone","es":"Cono secundario"},"stage":"secondary","control":null,"real_or_synthetic":"synthetic","expected_band":{"en":"Past the capacity hump the tonnage falls as the speed rises: between 650 and 1100 t/h, below what the same machine gives at its optimum speed, with P80 between 35 and 55 mm and a reduction ratio between 3 and 4.5.","es":"Pasada la joroba de capacidad el tonelaje cae al subir la velocidad: entre 650 y 1100 t/h, menos de lo que la misma máquina da en su velocidad óptima, con P80 entre 35 y 55 mm y razón de reducción entre 3 y 4,5."},"context":{"problem":{"en":"More speed looks like more crushing, but the gyrating head starts to obstruct the fall of material. The question is where the extra revolutions stop paying.","es":"Más velocidad parece más chancado, pero la cabeza en gyración empieza a obstruir la caída del material. La pregunta es dónde dejan de rendir las revoluciones adicionales."},"variables":{"en":"A secondary cone crusher with a closed-side setting of 50 mm, a throw of 30 mm and 470 rpm, on a Rosin-Rammler feed with x63 of 130 mm and m of 1, in an ore with A times b of 38 and a Bond work index of 17 kWh/t. The speed is the lever; the speed sweep shows the hump and this case sits on its falling side.","es":"Un chancador de cono secundario con abertura de lado cerrado de 50 mm, carrera de 30 mm y 470 rpm, sobre una alimentación Rosin-Rammler con x63 de 130 mm y m de 1, en un mineral con A por b de 38 e índice de trabajo de Bond de 17 kWh/t. La velocidad es la palanca; el barrido de velocidad muestra la joroba y este caso queda en su lado descendente."},"reading":{"en":"The marker of the operating speed sits to the right of the peak in the speed sweep. Read the tonnage lost against the same setting at the optimum speed.","es":"El marcador de la velocidad de operación queda a la derecha del máximo en el barrido de velocidad. Lea el tonelaje perdido frente a la misma abertura en la velocidad óptima."}},"engine":{"package":"pipeline.model.crusher","version":"0.11.000","model":"Whiten population balance with Andersen classification, JKMRC t10 and Austin appearance breakage, Evertsson capacity and Bond power"},"params":{"machine":"cone-sec","css_mm":50.0,"throw_mm":30.0,"speed_rpm":470.0,"feed_x63_mm":130.0,"feed_m":1.0,"ore_axb":38.0,"ore_wi":17.0,"calibrated":false},"seed":42,"artifact":{"path":"S03/trace.json","format":"json","trace_schema":"chancadem.trace/v1","bytes":4085,"sha256":"6116ae05d411d022bf29457b68083955c69b72da7483749107f6ee68ef1205bc"},"lane":"live","gate":{"lane":"live","pure_python":true,"wheels":[],"trace_bytes":4085,"run_ms_budget":1500.0,"trace_bytes_budget":262144,"reasons":[]},"flags":[],"metrics":{"p80_mm":42.3061,"p50_mm":18.86,"p20_mm":3.28636,"f80_mm":151.964,"reduction_ratio":3.59202,"throughput_tph":855.514,"power_kw":334.007,"specific_energy_kwh_t":1.32943},"models":{"surrogate-model":"real","anomaly-model":"real"},"expect":{"p80_mm":[35.0,55.0],"reduction_ratio":[3.0,4.5],"throughput_tph":[650.0,1100.0]},"source":{"kind":"authored"}}