{"schema":"chancadem.manifest/v1","case_id":"S01","title":{"en":"Cone secondary, medium ore, choke feed","es":"Cono secundario, mineral medio, alimentación atorada"},"category":{"en":"Secondary cone","es":"Cono secundario"},"stage":"secondary","control":null,"real_or_synthetic":"synthetic","expected_band":{"en":"The reference point: a well-graded choke feed at the capacity optimum gives a P80 between 22 and 35 mm, between 520 and 780 t/h and a reduction ratio between 3.5 and 5.5.","es":"El punto de referencia: una alimentación bien graduada y atorada en el óptimo de capacidad da un P80 entre 22 y 35 mm, entre 520 y 780 t/h y razón de reducción entre 3,5 y 5,5."},"context":{"problem":{"en":"The secondary cone is the workhorse of the circuit, and S01 is the operating point every other case is read against. The question is what a well-run secondary delivers.","es":"El cono secundario es el caballo de batalla del circuito, y S01 es el punto de operación frente al cual se lee cada otro caso. La pregunta es qué entrega un secundario bien operado."},"variables":{"en":"A secondary cone crusher with a closed-side setting of 32 mm, a throw of 30 mm and 360 rpm, on a Rosin-Rammler feed with x63 of 90 mm and m of 1.2, in an ore with A times b of 55 and a Bond work index of 14 kWh/t. Setting and speed move the product and the capacity most; the speed at which capacity peaks is 360 rpm for this machine.","es":"Un chancador de cono secundario con abertura de lado cerrado de 32 mm, carrera de 30 mm y 360 rpm, sobre una alimentación Rosin-Rammler con x63 de 90 mm y m de 1,2, en un mineral con A por b de 55 e índice de trabajo de Bond de 14 kWh/t. La abertura y la velocidad son las que más mueven el producto y la capacidad; la velocidad a la que la capacidad alcanza su máximo es 360 rpm para esta máquina."},"reading":{"en":"Read the speed sweep: the capacity hump peaks right at the operating speed. Every other secondary case is a departure from this point.","es":"Lea el barrido de velocidad: la joroba de capacidad alcanza su máximo justo en la velocidad de operación. Cada otro caso secundario es una desviación de este punto."}},"engine":{"package":"pipeline.model.crusher","version":"0.10.000","model":"Whiten population balance with Andersen classification, JKMRC t10 and Austin appearance breakage, Evertsson capacity and Bond power"},"params":{"machine":"cone-sec","css_mm":32.0,"throw_mm":30.0,"speed_rpm":360.0,"feed_x63_mm":90.0,"feed_m":1.2,"ore_axb":55.0,"ore_wi":14.0,"calibrated":false},"seed":42,"artifact":{"path":"S01/trace.json","format":"json","trace_schema":"chancadem.trace/v1","bytes":4029,"sha256":"41a1ea2811daa3a12e03606a8e1b528c7c00b473c38399bbe564122fb8ea45f1"},"lane":"live","gate":{"lane":"live","pure_python":true,"wheels":[],"trace_bytes":4029,"run_ms_budget":1500.0,"trace_bytes_budget":262144,"reasons":[]},"flags":[],"metrics":{"p80_mm":27.698,"p50_mm":12.09,"p20_mm":1.82902,"f80_mm":126.033,"reduction_ratio":4.55027,"throughput_tph":643.158,"power_kw":287.399,"specific_energy_kwh_t":1.01829},"models":{"surrogate-model":"real","anomaly-model":"real"},"expect":{"p80_mm":[22.0,35.0],"reduction_ratio":[3.5,5.5],"throughput_tph":[520.0,780.0]},"source":{"kind":"authored"}}