{"schema":"chancadem.manifest/v1","case_id":"G01","title":{"en":"Gyratory primary, hard ore, run-of-mine feed","es":"Giratorio primario, mineral duro, alimentación a granel"},"category":{"en":"Primary crushing","es":"Chancado primario"},"stage":"primary","control":null,"real_or_synthetic":"synthetic","expected_band":{"en":"Very high tonnage and a modest reduction: P80 between 115 and 182 mm, between 3500 and 5500 t/h and a reduction ratio between 1.05 and 1.5.","es":"Tonelaje muy alto y reducción modesta: P80 entre 115 y 182 mm, entre 3500 y 5500 t/h y razón de reducción entre 1,05 y 1,5."},"context":{"problem":{"en":"A primary gyratory takes the whole run-of-mine stream of a hard orebody and must deliver a product the secondary stage can handle. The question is how much size it removes at the tonnage it is bought for.","es":"Un giratorio primario recibe toda la corriente de mina de un cuerpo mineralizado duro y debe entregar un producto que la etapa secundaria pueda manejar. La pregunta es cuánto tamaño reduce al tonelaje para el que se compra."},"variables":{"en":"A primary gyratory crusher with a closed-side setting of 165 mm, a throw of 30 mm and 150 rpm, on a Rosin-Rammler feed with x63 of 600 mm and m of 0.8, in an ore with A times b of 40 and a Bond work index of 16 kWh/t. The setting sets the product and the discharge opening; the slow gyration of the primary keeps the capacity near its optimum.","es":"Un chancador giratorio primario con abertura de lado cerrado de 165 mm, carrera de 30 mm y 150 rpm, sobre una alimentación Rosin-Rammler con x63 de 600 mm y m de 0,8, en un mineral con A por b de 40 e índice de trabajo de Bond de 16 kWh/t. La abertura fija el producto y la abertura de descarga; la gyración lenta del primario mantiene la capacidad cerca de su óptimo."},"reading":{"en":"Read the product curve against the feed curve: the two are close, because a primary reduces by a factor of one to two, not by the factor of four a cone gives. The capacity is the point of this machine.","es":"Lea la curva del producto frente a la de alimentación: son cercanas, porque un primario reduce por un factor de uno a dos y no por el factor de cuatro de un cono. La capacidad es el sentido de esta máquina."}},"engine":{"package":"pipeline.model.crusher","version":"0.11.000","model":"Whiten population balance with Andersen classification, JKMRC t10 and Austin appearance breakage, Evertsson capacity and Bond power"},"params":{"machine":"gyratory","css_mm":165.0,"throw_mm":30.0,"speed_rpm":150.0,"feed_x63_mm":600.0,"feed_m":0.8,"ore_axb":40.0,"ore_wi":16.0,"calibrated":false},"seed":42,"artifact":{"path":"G01/trace.json","format":"json","trace_schema":"chancadem.trace/v1","bytes":4049,"sha256":"63418c158cdfc7d8ebd32ffcb751d3fb8e5d12c1a4d5629f4a31e3ec021cebc2"},"lane":"live","gate":{"lane":"live","pure_python":true,"wheels":[],"trace_bytes":4049,"run_ms_budget":1500.0,"trace_bytes_budget":262144,"reasons":[]},"flags":[],"metrics":{"p80_mm":153.599,"p50_mm":81.1207,"p20_mm":22.9134,"f80_mm":180.276,"reduction_ratio":1.17368,"throughput_tph":4628.57,"power_kw":145.403,"specific_energy_kwh_t":0.424286},"models":{"surrogate-model":"real","anomaly-model":"real"},"expect":{"p80_mm":[115.0,182.0],"reduction_ratio":[1.05,1.5],"throughput_tph":[3500.0,5500.0]},"source":{"kind":"authored"}}