{"schema":"chancadem.manifest/v1","case_id":"S02","title":{"en":"Cone secondary, soft ore, coarse feed","es":"Cono secundario, mineral blando, alimentación gruesa"},"category":{"en":"Secondary cone","es":"Cono secundario"},"stage":"secondary","control":null,"real_or_synthetic":"synthetic","expected_band":{"en":"A wider setting and a soft ore lift the capacity above S01 even below the optimum speed: P80 between 28 and 44 mm, between 660 and 900 t/h and a reduction ratio between 3.3 and 5.","es":"Una abertura mayor y un mineral blando elevan la capacidad sobre S01 aun bajo la velocidad óptima: P80 entre 28 y 44 mm, entre 660 y 900 t/h y razón de reducción entre 3,3 y 5."},"context":{"problem":{"en":"Soft ore with a coarse feed tempts the operator to open the setting and slow the machine. The question is what that costs in product size and what it gains in tonnage.","es":"El mineral blando con alimentación gruesa tienta al operador a abrir la abertura y bajar la velocidad. La pregunta es qué cuesta eso en tamaño de producto y qué gana en tonelaje."},"variables":{"en":"A secondary cone crusher with a closed-side setting of 40 mm, a throw of 32 mm and 300 rpm, on a Rosin-Rammler feed with x63 of 120 mm and m of 1, in an ore with A times b of 80 and a Bond work index of 11 kWh/t. The opening raises the capacity while the speed below the optimum takes some of it back.","es":"Un chancador de cono secundario con abertura de lado cerrado de 40 mm, carrera de 32 mm y 300 rpm, sobre una alimentación Rosin-Rammler con x63 de 120 mm y m de 1, en un mineral con A por b de 80 e índice de trabajo de Bond de 11 kWh/t. La abertura eleva la capacidad mientras la velocidad bajo el óptimo se lleva parte de ella."},"reading":{"en":"Compare with S01: the product is coarser by about the extra setting, the tonnage is higher, and the power draw is lower. The wider opening is the reason, and the lower speed keeps the capacity from rising further.","es":"Compare con S01: el producto es más grueso en proporción a la abertura adicional, el tonelaje es mayor y la potencia es menor. La abertura mayor es la razón, y la menor velocidad impide que la capacidad suba aún más."}},"engine":{"package":"pipeline.model.crusher","version":"0.10.000","model":"Whiten population balance with Andersen classification, JKMRC t10 and Austin appearance breakage, Evertsson capacity and Bond power"},"params":{"machine":"cone-sec","css_mm":40.0,"throw_mm":32.0,"speed_rpm":300.0,"feed_x63_mm":120.0,"feed_m":1.0,"ore_axb":80.0,"ore_wi":11.0,"calibrated":false},"seed":42,"artifact":{"path":"S02/trace.json","format":"json","trace_schema":"chancadem.trace/v1","bytes":4054,"sha256":"6211819605c2559e70bd307e37e9eddb8fe1545c5c27c858496219375c3f9ba2"},"lane":"live","gate":{"lane":"live","pure_python":true,"wheels":[],"trace_bytes":4054,"run_ms_budget":1500.0,"trace_bytes_budget":262144,"reasons":[]},"flags":[],"metrics":{"p80_mm":33.7983,"p50_mm":14.123,"p20_mm":2.26831,"f80_mm":147.142,"reduction_ratio":4.35354,"throughput_tph":754.413,"power_kw":235.054,"specific_energy_kwh_t":0.848571},"models":{"surrogate-model":"real","anomaly-model":"real"},"expect":{"p80_mm":[28.0,44.0],"reduction_ratio":[3.3,5.0],"throughput_tph":[660.0,900.0]},"source":{"kind":"authored"}}