{"schema":"chancadem.manifest/v1","case_id":"FX02","title":{"en":"Fixture: HP500 survey 1","es":"Fixture: muestreo HP500 1"},"category":{"en":"Real surveys: Metso HP500 at Minas Rio","es":"Muestreos reales: Metso HP500 en Minas Rio"},"stage":"secondary","control":null,"real_or_synthetic":"real","expected_band":{"en":"Survey 1 measured 1639 t/h and 209 kW at a setting of 54 mm and a feed f80 of 88 mm. The calibrated engine should land within 29 percent of the measured throughput, between 1164 and 2114 t/h, with a P80 between 18.9 and 59.4 mm (0.35 to 1.1 times the setting) and a reduction ratio between 1.8 and 4.","es":"El muestreo 1 midió 1639 t/h y 209 kW con una abertura de 54 mm y un f80 de alimentación de 88 mm. El motor calibrado debe quedar dentro de 29 por ciento del tonelaje medido, entre 1164 y 2114 t/h, con un P80 entre 18,9 y 59,4 mm (0,35 a 1,1 veces la abertura) y una razón de reducción entre 1,8 y 4."},"context":{"problem":{"en":"The provider real case of the walking skeleton, at HP500 survey 1. It is scaffolding, labelled as a provider on every surface.","es":"El caso real proveedor del esqueleto, en el muestreo HP500 1. Es andamiaje, rotulado como proveedor en cada superficie."},"variables":{"en":"Measured closed-side setting 54 mm and feed f80 88 mm; measured feed rate 1639 t/h and power 209 kW. The throw and the speed are the HP500 nominal values and the feed shape is reconstructed from the f80.","es":"Abertura de lado cerrado medida 54 mm y f80 de alimentación 88 mm; flujo de alimentación medido 1639 t/h y potencia 209 kW. La carrera y la velocidad son los valores nominales del HP500 y la forma de la alimentación se reconstruye a partir del f80."},"reading":{"en":"The real case HP500-01 replaces it when the pipeline bakes. Read it only to check that a view works.","es":"El caso real HP500-01 lo reemplaza cuando el pipeline genera. Léalo solo para comprobar que una vista funciona."}},"engine":{"package":"pipeline.model.crusher","version":"0.09.003","model":"Whiten population balance with Andersen classification, JKMRC t10 and Austin appearance breakage, Evertsson capacity and Bond power (HP500 calibration of Rocha et al. 2024)"},"params":{"machine":"cone-sec","css_mm":54.0,"throw_mm":34.0,"speed_rpm":360.0,"feed_x63_mm":51.8614483895739,"feed_m":0.9,"ore_axb":677.3,"ore_wi":9.0,"calibrated":true},"seed":42,"artifact":{"path":"FX02/trace.json","format":"json","trace_schema":"chancadem.trace/v1","bytes":3957,"sha256":"bcf9065850035234b8ad71cb55272a45d210ee0a5778bed7f049753718b97e7a"},"lane":"live","gate":{"lane":"live","pure_python":true,"wheels":[],"trace_bytes":3957,"run_ms_budget":1500.0,"trace_bytes_budget":262144,"reasons":[]},"flags":[],"metrics":{"p80_mm":32.557,"p50_mm":14.3217,"p20_mm":3.10859,"f80_mm":84.8615,"reduction_ratio":2.60655,"throughput_tph":1208.87,"power_kw":408.345,"specific_energy_kwh_t":1.01829,"throughput_err_pct":-26.2435,"power_err_pct":95.3803},"models":{"surrogate-model":"real","anomaly-model":"real"},"expect":{"p80_mm":[18.9,59.4],"reduction_ratio":[1.8,4.0],"throughput_tph":[1164.0,2114.0]},"source":{"kind":"publication","citation":"Rocha, B.K.N.d.; Campos, T.M.; Silva, J.; Tavares, L.M. Fit-for-Purpose Model of HP500 Cone Crusher in Size Reduction of Itabirite Iron Ore. Minerals 2024, 14(9), 919. https://doi.org/10.3390/min14090919 (CC BY 4.0).","doi":"10.3390/min14090919","license":"CC BY 4.0"},"measured":{"survey":1,"f80_mm":88.0,"css_mm":54.0,"feed_tph":1639.0,"power_kw":209.0}}