{"schema":"chancadem.manifest/v1","case_id":"S04","title":{"en":"Cone secondary, hard ore, run-of-mine feed","es":"Cono secundario, mineral duro, alimentación a granel"},"category":{"en":"Secondary cone","es":"Cono secundario"},"stage":"secondary","control":null,"real_or_synthetic":"synthetic","expected_band":{"en":"A heavy-duty secondary on a coarse feed at the optimum: P80 between 56 and 88 mm, between 1000 and 1700 t/h and a reduction ratio between 1.8 and 3.","es":"Un secundario de servicio pesado sobre alimentación gruesa en el óptimo: P80 entre 56 y 88 mm, entre 1000 y 1700 t/h y razón de reducción entre 1,8 y 3."},"context":{"problem":{"en":"Some plants run the secondary directly on run-of-mine fragments. The question is how coarse the product becomes and how much tonnage the wide opening buys.","es":"Algunas plantas operan el secundario directamente sobre fragmentos de mina. La pregunta es cuán grueso queda el producto y cuánto tonelaje compra la abertura ancha."},"variables":{"en":"A secondary cone crusher with a closed-side setting of 80 mm, a throw of 36 mm and 360 rpm, on a Rosin-Rammler feed with x63 of 180 mm and m of 0.9, in an ore with A times b of 40 and a Bond work index of 16 kWh/t. The setting dominates: at 80 mm the product is the coarsest of the secondary cases and the capacity the highest.","es":"Un chancador de cono secundario con abertura de lado cerrado de 80 mm, carrera de 36 mm y 360 rpm, sobre una alimentación Rosin-Rammler con x63 de 180 mm y m de 0,9, en un mineral con A por b de 40 e índice de trabajo de Bond de 16 kWh/t. La abertura domina: con 80 mm el producto es el más grueso de los casos secundarios y la capacidad la mayor."},"reading":{"en":"Compare with S01: a setting 2.5 times larger gives a product about 2.5 times coarser. The reduction ratio shows how little work the machine does here.","es":"Compare con S01: una abertura 2,5 veces mayor da un producto cerca de 2,5 veces más grueso. La razón de reducción muestra cuán poco trabajo hace la máquina aquí."}},"engine":{"package":"pipeline.model.crusher","version":"0.10.000","model":"Whiten population balance with Andersen classification, JKMRC t10 and Austin appearance breakage, Evertsson capacity and Bond power"},"params":{"machine":"cone-sec","css_mm":80.0,"throw_mm":36.0,"speed_rpm":360.0,"feed_x63_mm":180.0,"feed_m":0.9,"ore_axb":40.0,"ore_wi":16.0,"calibrated":false},"seed":42,"artifact":{"path":"S04/trace.json","format":"json","trace_schema":"chancadem.trace/v1","bytes":4066,"sha256":"1966b05dd69ecc1e5a0ae0b72174e7b549a45d0094b15a2d404067e81ab43aa6"},"lane":"live","gate":{"lane":"live","pure_python":true,"wheels":[],"trace_bytes":4066,"run_ms_budget":1500.0,"trace_bytes_budget":262144,"reasons":[]},"flags":[],"metrics":{"p80_mm":70.466,"p50_mm":33.0818,"p20_mm":6.95104,"f80_mm":161.807,"reduction_ratio":2.29625,"throughput_tph":1341.05,"power_kw":274.89,"specific_energy_kwh_t":1.01829},"models":{"surrogate-model":"real","anomaly-model":"real"},"expect":{"p80_mm":[56.0,88.0],"reduction_ratio":[1.8,3.0],"throughput_tph":[1000.0,1700.0]},"source":{"kind":"authored"}}