{"schema":"chancadem.manifest/v1","case_id":"G02","title":{"en":"Gyratory primary, soft ore, high tonnage","es":"Giratorio primario, mineral blando, alto tonelaje"},"category":{"en":"Primary crushing","es":"Chancado primario"},"stage":"primary","control":null,"real_or_synthetic":"synthetic","expected_band":{"en":"The widest setting of the primary cases sits at the feed's F80, so the feed is barely touched: P80 between 140 and 200 mm, a reduction ratio between 1 and 1.3 and the highest tonnage of the matrix, between 4500 and 6500 t/h. The engine flags the point as pass-through.","es":"La abertura más ancha de los casos primarios queda en el F80 de la alimentación, así que el material casi no se toca: P80 entre 140 y 200 mm, razón de reducción entre 1 y 1,3 y el mayor tonelaje de la matriz, entre 4500 y 6500 t/h. El motor marca el punto como paso directo."},"context":{"problem":{"en":"Soft ore lets the plant open the primary to the limit and chase tonnage. The question is where that stops being crushing and starts being a chute.","es":"El mineral blando permite abrir el primario al máximo y buscar tonelaje. La pregunta es dónde eso deja de ser chancado y pasa a ser una canaleta."},"variables":{"en":"A primary gyratory crusher with a closed-side setting of 195 mm, a throw of 32 mm and 160 rpm, on a Rosin-Rammler feed with x63 of 700 mm and m of 0.85, in an ore with A times b of 78 and a Bond work index of 12 kWh/t. The setting is the lever: once it reaches the F80 of the feed the pass-through flag appears and the reduction ratio falls toward one.","es":"Un chancador giratorio primario con abertura de lado cerrado de 195 mm, carrera de 32 mm y 160 rpm, sobre una alimentación Rosin-Rammler con x63 de 700 mm y m de 0,85, en un mineral con A por b de 78 e índice de trabajo de Bond de 12 kWh/t. La abertura es la palanca: cuando alcanza el F80 de la alimentación aparece la marca de paso directo y la razón de reducción cae hacia uno."},"reading":{"en":"Compare it with G01: the same machine at a setting 30 mm wider gives more tonnage and almost no size reduction. The flag is the engine telling the truth, not an error.","es":"Compárelo con G01: la misma máquina con una abertura 30 mm mayor da más tonelaje y casi ninguna reducción de tamaño. La marca es el motor diciendo la verdad, no un error."}},"engine":{"package":"pipeline.model.crusher","version":"0.10.000","model":"Whiten population balance with Andersen classification, JKMRC t10 and Austin appearance breakage, Evertsson capacity and Bond power"},"params":{"machine":"gyratory","css_mm":195.0,"throw_mm":32.0,"speed_rpm":160.0,"feed_x63_mm":700.0,"feed_m":0.85,"ore_axb":78.0,"ore_wi":12.0,"calibrated":false},"seed":42,"artifact":{"path":"G02/trace.json","format":"json","trace_schema":"chancadem.trace/v1","bytes":4085,"sha256":"dd90e6190421f976704a4ed0f1e10df96a9acf053b020591a3c3472b5c8b9e16"},"lane":"live","gate":{"lane":"live","pure_python":true,"wheels":[],"trace_bytes":4085,"run_ms_budget":1500.0,"trace_bytes_budget":262144,"reasons":[]},"flags":["pass_through","f80_lt_css"],"metrics":{"p80_mm":170.141,"p50_mm":91.6448,"p20_mm":27.7598,"f80_mm":185.817,"reduction_ratio":1.09214,"throughput_tph":5414.18,"power_kw":67.9041,"specific_energy_kwh_t":0.452571},"models":{"surrogate-model":"real","anomaly-model":"real"},"expect":{"p80_mm":[140.0,200.0],"reduction_ratio":[1.0,1.3],"throughput_tph":[4500.0,6500.0]},"source":{"kind":"authored"}}