{"schema":"chancadem.manifest/v1","case_id":"CK1","title":{"en":"Calibration anchor, HP-class cone","es":"Ancla de calibración, cono de clase HP"},"category":{"en":"Controls","es":"Controles"},"stage":"control","control":"calibration","real_or_synthetic":"synthetic","expected_band":{"en":"An operating point chosen as the anchor for absolute-number calibration against published industrial cone data: P80 between 17 and 28 mm, between 450 and 650 t/h and a reduction ratio between 4 and 6.5.","es":"Un punto de operación elegido como ancla de la calibración de números absolutos frente a datos industriales publicados de conos: P80 entre 17 y 28 mm, entre 450 y 650 t/h y razón de reducción entre 4 y 6,5."},"context":{"problem":{"en":"The shape of the curves is not enough: a decision needs the absolute numbers right. This point is where the engine is compared with published HP-class cone data (Duarte et al. 2021).","es":"La forma de las curvas no basta: una decisión necesita los números absolutos correctos. Este punto es donde el motor se compara con datos publicados de conos de clase HP (Duarte et al. 2021)."},"variables":{"en":"A secondary cone crusher with a closed-side setting of 25 mm, a throw of 30 mm and 350 rpm, on a Rosin-Rammler feed with x63 of 80 mm and m of 1.15, in an ore with A times b of 52 and a Bond work index of 15 kWh/t. The setting of 25 mm and the 350 rpm speed place it between S01 and S05.","es":"Un chancador de cono secundario con abertura de lado cerrado de 25 mm, carrera de 30 mm y 350 rpm, sobre una alimentación Rosin-Rammler con x63 de 80 mm y m de 1,15, en un mineral con A por b de 52 e índice de trabajo de Bond de 15 kWh/t. La abertura de 25 mm y la velocidad de 350 rpm lo ubican entre S01 y S05."},"reading":{"en":"The fit to the published data is still pending, so these ranges come from the crushing relation of the setting and not from that data. The measured HP500 surveys are the real check of the absolute numbers.","es":"El ajuste a los datos publicados sigue pendiente, así que estos rangos vienen de la relación de chancado con la abertura y no de esos datos. Los muestreos HP500 medidos son la verificación real de los números absolutos."}},"engine":{"package":"pipeline.model.crusher","version":"0.09.003","model":"Whiten population balance with Andersen classification, JKMRC t10 and Austin appearance breakage, Evertsson capacity and Bond power"},"params":{"machine":"cone-sec","css_mm":25.0,"throw_mm":30.0,"speed_rpm":350.0,"feed_x63_mm":80.0,"feed_m":1.15,"ore_axb":52.0,"ore_wi":15.0,"calibrated":false},"seed":42,"artifact":{"path":"CK1/trace.json","format":"json","trace_schema":"chancadem.trace/v1","bytes":4061,"sha256":"84f95ad630dbc8f1292080ed55930973c8a9178cf883db852b901ae30ea87b4c"},"lane":"live","gate":{"lane":"live","pure_python":true,"wheels":[],"trace_bytes":4061,"run_ms_budget":1500.0,"trace_bytes_budget":262144,"reasons":[]},"flags":[],"metrics":{"p80_mm":21.7232,"p50_mm":9.16578,"p20_mm":1.38151,"f80_mm":116.18,"reduction_ratio":5.34819,"throughput_tph":547.153,"power_kw":316.062,"specific_energy_kwh_t":0.99},"models":{"surrogate-model":"real","anomaly-model":"real"},"expect":{"p80_mm":[17.0,28.0],"reduction_ratio":[4.0,6.5],"throughput_tph":[450.0,650.0]},"source":{"kind":"authored"}}