{"schema":"chancadem.manifest/v1","case_id":"CP1","title":{"en":"Pass-through, negative control","es":"Paso directo, control negativo"},"category":{"en":"Controls","es":"Controles"},"stage":"control","control":"negative","real_or_synthetic":"synthetic","expected_band":{"en":"A setting wider than the F80: the material passes mostly ungripped, with P80 between 100 and 126 mm, a reduction ratio between 1 and 1.3 and between 1900 and 2900 t/h. The engine flags the pass-through regime.","es":"Una abertura mayor que el F80: el material pasa casi sin agarrarse, con P80 entre 100 y 126 mm, razón de reducción entre 1 y 1,3 y entre 1900 y 2900 t/h. El motor marca el régimen de paso directo."},"context":{"problem":{"en":"A model that shows a pretty product curve for a crusher that is not crushing is worse than no model. This control asks the engine to show nothing happening.","es":"Un modelo que muestra una curva de producto vistosa para un chancador que no chanca es peor que ningún modelo. Este control le pide al motor que muestre que no ocurre nada."},"variables":{"en":"A secondary cone crusher with a closed-side setting of 160 mm, a throw of 30 mm and 360 rpm, on a Rosin-Rammler feed with x63 of 90 mm and m of 1.2, in an ore with A times b of 55 and a Bond work index of 14 kWh/t. The setting is 160 mm against a feed F80 of 126 mm, everything else as in S01.","es":"Un chancador de cono secundario con abertura de lado cerrado de 160 mm, carrera de 30 mm y 360 rpm, sobre una alimentación Rosin-Rammler con x63 de 90 mm y m de 1,2, en un mineral con A por b de 55 e índice de trabajo de Bond de 14 kWh/t. La abertura es 160 mm frente a un F80 de alimentación de 126 mm, todo lo demás como en S01."},"reading":{"en":"The product curve lies on the feed curve and the power is a fraction of S01. If a view shows a clear reduction here, the view is wrong.","es":"La curva del producto queda sobre la de alimentación y la potencia es una fracción de la de S01. Si una vista muestra aquí una reducción clara, la vista está mal."}},"engine":{"package":"pipeline.model.crusher","version":"0.09.003","model":"Whiten population balance with Andersen classification, JKMRC t10 and Austin appearance breakage, Evertsson capacity and Bond power"},"params":{"machine":"cone-sec","css_mm":160.0,"throw_mm":30.0,"speed_rpm":360.0,"feed_x63_mm":90.0,"feed_m":1.2,"ore_axb":55.0,"ore_wi":14.0,"calibrated":false},"seed":42,"artifact":{"path":"CP1/trace.json","format":"json","trace_schema":"chancadem.trace/v1","bytes":4127,"sha256":"b951863615a176edd6fb8220fcd9cfcfa927cb4244986656ca29dfc6c2c2a91f"},"lane":"live","gate":{"lane":"live","pure_python":true,"wheels":[],"trace_bytes":4127,"run_ms_budget":1500.0,"trace_bytes_budget":262144,"reasons":[]},"flags":["pass_through","f80_lt_css"],"metrics":{"p80_mm":112.274,"p50_mm":57.912,"p20_mm":21.8711,"f80_mm":126.033,"reduction_ratio":1.12255,"throughput_tph":2394.74,"power_kw":56.1963,"specific_energy_kwh_t":1.01829},"models":{"surrogate-model":"real","anomaly-model":"real"},"expect":{"p80_mm":[100.0,126.0],"reduction_ratio":[1.0,1.3],"throughput_tph":[1900.0,2900.0]},"source":{"kind":"authored"}}