{"schema":"chancadem.manifest/v1","case_id":"T01","title":{"en":"Cone tertiary, fine feed","es":"Cono terciario, alimentación fina"},"category":{"en":"Tertiary crushing","es":"Chancado terciario"},"stage":"tertiary","control":null,"real_or_synthetic":"synthetic","expected_band":{"en":"A fine feed and a tight setting at the tertiary optimum speed: P80 between 5.5 and 9 mm, between 180 and 320 t/h and a reduction ratio between 4.2 and 7.","es":"Una alimentación fina y una abertura cerrada en la velocidad óptima terciaria: P80 entre 5,5 y 9 mm, entre 180 y 320 t/h y razón de reducción entre 4,2 y 7."},"context":{"problem":{"en":"The tertiary stage prepares the feed of the mills or the screens. The question is what product a tertiary cone makes at an 8 mm setting.","es":"La etapa terciaria prepara la alimentación de los molinos o de las cribas. La pregunta es qué producto hace un cono terciario con una abertura de 8 mm."},"variables":{"en":"A tertiary cone crusher with a closed-side setting of 8 mm, a throw of 16 mm and 400 rpm, on a Rosin-Rammler feed with x63 of 28 mm and m of 1.5, in an ore with A times b of 55 and a Bond work index of 14 kWh/t. The setting and the faster optimum speed of the tertiary machine are the levers.","es":"Un chancador de cono terciario con abertura de lado cerrado de 8 mm, carrera de 16 mm y 400 rpm, sobre una alimentación Rosin-Rammler con x63 de 28 mm y m de 1,5, en un mineral con A por b de 55 e índice de trabajo de Bond de 14 kWh/t. La abertura y la velocidad óptima más alta de la máquina terciaria son las palancas."},"reading":{"en":"Compare with the secondary cases: the tonnage is a third of S01 and the product is a quarter of its size. A tertiary stage trades tonnage for fineness.","es":"Compare con los casos secundarios: el tonelaje es un tercio del de S01 y el producto tiene un cuarto de su tamaño. Una etapa terciaria cambia tonelaje por finura."}},"engine":{"package":"pipeline.model.crusher","version":"0.10.000","model":"Whiten population balance with Andersen classification, JKMRC t10 and Austin appearance breakage, Evertsson capacity and Bond power"},"params":{"machine":"cone-tert","css_mm":8.0,"throw_mm":16.0,"speed_rpm":400.0,"feed_x63_mm":28.0,"feed_m":1.5,"ore_axb":55.0,"ore_wi":14.0,"calibrated":false},"seed":42,"artifact":{"path":"T01/trace.json","format":"json","trace_schema":"chancadem.trace/v1","bytes":3944,"sha256":"db814190e8f49a4334f8a8244dced0322e8434ed65734bfdaf2d7836423d797d"},"lane":"live","gate":{"lane":"live","pure_python":true,"wheels":[],"trace_bytes":3944,"run_ms_budget":1500.0,"trace_bytes_budget":262144,"reasons":[]},"flags":[],"metrics":{"p80_mm":7.11095,"p50_mm":3.23451,"p20_mm":0.498762,"f80_mm":38.9695,"reduction_ratio":5.48022,"throughput_tph":240.0,"power_kw":228.245,"specific_energy_kwh_t":0.603429},"models":{"surrogate-model":"real","anomaly-model":"real"},"expect":{"p80_mm":[5.5,9.0],"reduction_ratio":[4.2,7.0],"throughput_tph":[180.0,320.0]},"source":{"kind":"authored"}}