{"schema":"chancadem.manifest/v1","case_id":"CI1","title":{"en":"Setting above the feed top size, invalid control","es":"Abertura sobre el tamaño máximo, control inválido"},"category":{"en":"Controls","es":"Controles"},"stage":"control","control":"invalid","real_or_synthetic":"synthetic","expected_band":{"en":"A setting wider than the 256 mm top size of the feed is physically meaningless: P80 between 120 and 130 mm and a reduction ratio between 0.95 and 1.05. The engine must flag the point invalid with the code css_ge_feed_top.","es":"Una abertura mayor que el tamaño máximo de 256 mm de la alimentación no tiene sentido físico: P80 entre 120 y 130 mm y razón de reducción entre 0,95 y 1,05. El motor debe marcar el punto como inválido con el código css_ge_feed_top."},"context":{"problem":{"en":"A tool that accepts any slider position must say when a position is not a crusher. This control puts the setting beyond every particle of the feed.","es":"Una herramienta que acepta cualquier posición de un control deslizante debe decir cuándo una posición no es un chancador. Este control pone la abertura más allá de cada partícula de la alimentación."},"variables":{"en":"A secondary cone crusher with a closed-side setting of 280 mm, a throw of 30 mm and 360 rpm, on a Rosin-Rammler feed with x63 of 90 mm and m of 1.2, in an ore with A times b of 55 and a Bond work index of 14 kWh/t. The setting is 280 mm, above the feed top size; the rest is as in S01.","es":"Un chancador de cono secundario con abertura de lado cerrado de 280 mm, carrera de 30 mm y 360 rpm, sobre una alimentación Rosin-Rammler con x63 de 90 mm y m de 1,2, en un mineral con A por b de 55 e índice de trabajo de Bond de 14 kWh/t. La abertura es 280 mm, sobre el tamaño máximo de la alimentación; el resto es como en S01."},"reading":{"en":"The product equals the feed and the case is flagged invalid. A view that renders it without the flag is silently wrong.","es":"El producto es igual a la alimentación y el caso queda marcado como inválido. Una vista que lo muestre sin la marca está en silencio equivocada."}},"engine":{"package":"pipeline.model.crusher","version":"0.09.003","model":"Whiten population balance with Andersen classification, JKMRC t10 and Austin appearance breakage, Evertsson capacity and Bond power"},"params":{"machine":"cone-sec","css_mm":280.0,"throw_mm":30.0,"speed_rpm":360.0,"feed_x63_mm":90.0,"feed_m":1.2,"ore_axb":55.0,"ore_wi":14.0,"calibrated":false},"seed":42,"artifact":{"path":"CI1/trace.json","format":"json","trace_schema":"chancadem.trace/v1","bytes":3910,"sha256":"f930e665fccf7569280161761496868c033bf1dc6f1f9e86c0acc36b9fdcc884"},"lane":"live","gate":{"lane":"live","pure_python":true,"wheels":[],"trace_bytes":3910,"run_ms_budget":1500.0,"trace_bytes_budget":262144,"reasons":[]},"flags":["css_ge_feed_top","f80_lt_css","pass_through"],"metrics":{"p80_mm":126.033,"p50_mm":63.9439,"p20_mm":24.7863,"f80_mm":126.033,"reduction_ratio":1.0,"throughput_tph":4036.84,"power_kw":0.0,"specific_energy_kwh_t":1.01829},"models":{"surrogate-model":"real","anomaly-model":"real"},"expect":{"p80_mm":[120.0,130.0],"reduction_ratio":[0.95,1.05]},"source":{"kind":"authored"}}