{"schema":"chancadem.manifest/v1","case_id":"J02","title":{"en":"Jaw primary, medium ore, trickle feed","es":"Mandíbulas primario, mineral medio, alimentación a goteo"},"category":{"en":"Primary crushing","es":"Chancado primario"},"stage":"primary","control":null,"real_or_synthetic":"synthetic","expected_band":{"en":"A tighter jaw gives a finer product at lower tonnage: P80 between 56 and 90 mm, between 450 and 800 t/h and a reduction ratio between 1.8 and 2.8.","es":"Un chancador de mandíbulas más cerrado da un producto más fino con menor tonelaje: P80 entre 56 y 90 mm, entre 450 y 800 t/h y razón de reducción entre 1,8 y 2,8."},"context":{"problem":{"en":"When the feed trickles in below choke the jaw works with low fill. The question is how much finer the product is than in the wide, hard case J01.","es":"Cuando la alimentación llega a goteo bajo el atoramiento, el chancador trabaja con poco llenado. La pregunta es cuánto más fino es el producto que en el caso ancho y duro J01."},"variables":{"en":"A primary jaw crusher with a closed-side setting of 80 mm, a throw of 36 mm and 280 rpm, on a Rosin-Rammler feed with x63 of 300 mm and m of 1, in an ore with A times b of 55 and a Bond work index of 14 kWh/t. The setting is the lever for both the product and the capacity: closing it from 125 to 80 mm cuts the tonnage and the product size together.","es":"Un chancador de mandíbulas primario con abertura de lado cerrado de 80 mm, carrera de 36 mm y 280 rpm, sobre una alimentación Rosin-Rammler con x63 de 300 mm y m de 1, en un mineral con A por b de 55 e índice de trabajo de Bond de 14 kWh/t. La abertura es la palanca del producto y de la capacidad: cerrarla de 125 a 80 mm reduce a la vez el tonelaje y el tamaño del producto."},"reading":{"en":"Put J01 and J02 side by side: the reduction ratio rises by half while the tonnage drops. That is the trade a primary operator manages every day.","es":"Ponga J01 y J02 lado a lado: la razón de reducción sube en la mitad mientras baja el tonelaje. Ese es el compromiso que un operador de primario maneja cada día."}},"engine":{"package":"pipeline.model.crusher","version":"0.09.003","model":"Whiten population balance with Andersen classification, JKMRC t10 and Austin appearance breakage, Evertsson capacity and Bond power"},"params":{"machine":"jaw","css_mm":80.0,"throw_mm":36.0,"speed_rpm":280.0,"feed_x63_mm":300.0,"feed_m":1.0,"ore_axb":55.0,"ore_wi":14.0,"calibrated":false},"seed":42,"artifact":{"path":"J02/trace.json","format":"json","trace_schema":"chancadem.trace/v1","bytes":4112,"sha256":"4ed5602f880ad65c2d494fcc28276c0e04076fa18646249b94de47cb2251c744"},"lane":"live","gate":{"lane":"live","pure_python":true,"wheels":[],"trace_bytes":4112,"run_ms_budget":1500.0,"trace_bytes_budget":262144,"reasons":[]},"flags":[],"metrics":{"p80_mm":82.4356,"p50_mm":40.0504,"p20_mm":8.26458,"f80_mm":184.246,"reduction_ratio":2.23503,"throughput_tph":622.187,"power_kw":100.452,"specific_energy_kwh_t":1.0032},"models":{"surrogate-model":"real","anomaly-model":"real"},"expect":{"p80_mm":[56.0,90.0],"reduction_ratio":[1.8,2.8],"throughput_tph":[450.0,800.0]},"source":{"kind":"authored"}}