{"schema":"chancadem.manifest/v1","case_id":"S05","title":{"en":"Cone secondary, fines-heavy feed","es":"Cono secundario, alimentación con muchos finos"},"category":{"en":"Secondary cone","es":"Cono secundario"},"stage":"secondary","control":null,"real_or_synthetic":"synthetic","expected_band":{"en":"A tight setting on a fine feed gives a high reduction and a fine product, finer than S01: P80 between 11 and 18 mm, between 300 and 500 t/h and a reduction ratio between 4.5 and 7.","es":"Una abertura cerrada sobre alimentación fina da una reducción alta y un producto fino, más fino que S01: P80 entre 11 y 18 mm, entre 300 y 500 t/h y razón de reducción entre 4,5 y 7."},"context":{"problem":{"en":"A fines-heavy feed packs the chamber and cuts the capacity, yet it is what many plants deliver after screening. The question is what a tight setting makes of it.","es":"Una alimentación con muchos finos empaqueta la cámara y reduce la capacidad, pero es lo que muchas plantas entregan después de cribar. La pregunta es qué hace de ella una abertura cerrada."},"variables":{"en":"A secondary cone crusher with a closed-side setting of 16 mm, a throw of 26 mm and 360 rpm, on a Rosin-Rammler feed with x63 of 55 mm and m of 1.6, in an ore with A times b of 55 and a Bond work index of 14 kWh/t. The setting and the feed uniformity are the levers: a high m means few oversize particles, so the cone works on material already near its setting.","es":"Un chancador de cono secundario con abertura de lado cerrado de 16 mm, carrera de 26 mm y 360 rpm, sobre una alimentación Rosin-Rammler con x63 de 55 mm y m de 1,6, en un mineral con A por b de 55 e índice de trabajo de Bond de 14 kWh/t. La abertura y la uniformidad de la alimentación son las palancas: una m alta significa pocas partículas sobretamaño, así que el cono trabaja material ya cercano a su abertura."},"reading":{"en":"Read the product curve against S01: it is shifted to the fine side by about half. Watch the capacity, which falls with the opening.","es":"Lea la curva del producto frente a S01: queda desplazada hacia lo fino en cerca de la mitad. Observe la capacidad, que cae con la abertura."}},"engine":{"package":"pipeline.model.crusher","version":"0.10.000","model":"Whiten population balance with Andersen classification, JKMRC t10 and Austin appearance breakage, Evertsson capacity and Bond power"},"params":{"machine":"cone-sec","css_mm":16.0,"throw_mm":26.0,"speed_rpm":360.0,"feed_x63_mm":55.0,"feed_m":1.6,"ore_axb":55.0,"ore_wi":14.0,"calibrated":false},"seed":42,"artifact":{"path":"S05/trace.json","format":"json","trace_schema":"chancadem.trace/v1","bytes":4014,"sha256":"9d5524b462b1ee6c930a29598bb0478339df586e6e116bc9f4c8bce550893ea8"},"lane":"live","gate":{"lane":"live","pure_python":true,"wheels":[],"trace_bytes":4014,"run_ms_budget":1500.0,"trace_bytes_budget":262144,"reasons":[]},"flags":[],"metrics":{"p80_mm":13.6425,"p50_mm":5.43622,"p20_mm":0.724299,"f80_mm":75.2128,"reduction_ratio":5.51312,"throughput_tph":396.842,"power_kw":273.081,"specific_energy_kwh_t":1.01829},"models":{"surrogate-model":"real","anomaly-model":"real"},"expect":{"p80_mm":[11.0,18.0],"reduction_ratio":[4.5,7.0],"throughput_tph":[300.0,500.0]},"source":{"kind":"authored"}}